{"schema_version":"0.2.0","fixture_id":"eval-pnpm-workspace-logger","split":"held-out","package_manager":"pnpm","failure_class":"workspace-package","failure_pattern":"ERR_PNPM_WORKSPACE_PKG_NOT_FOUND","task_prompt":"Repair the offline pnpm workspace dependency failure. Preserve all unrelated root metadata, make the smallest safe package.json change, and verify with the provided offline command.","reproduce":{"program":"pnpm","args":["install","--offline","--ignore-scripts","--frozen-lockfile=false","--reporter=append-only"]},"verify":{"program":"pnpm","args":["install","--offline","--ignore-scripts","--frozen-lockfile=false","--reporter=append-only"]},"safety":{"offline":true,"allow_scripts":false,"writes_outside_repository":false}}
