{"schema_version":"0.2.0","fixture_id":"train-npm-peer-react","split":"training","package_manager":"npm","failure_class":"peer-range","failure_pattern":"ERESOLVE","task_prompt":"Repair the offline npm dependency-resolution failure. Diagnose from repository files, make the smallest safe package.json change, and verify with the provided offline command.","reproduce":{"program":"npm","args":["install","--offline","--ignore-scripts","--no-audit","--no-fund","--package-lock=false"]},"verify":{"program":"npm","args":["install","--offline","--ignore-scripts","--no-audit","--no-fund","--package-lock=false"]},"safety":{"offline":true,"allow_scripts":false,"writes_outside_repository":false}}
